word,exp_1,exp_2,exp_3,answer
ЦУЙКА,фруктовая водка у румын и молдаван,мелкий вальдшнеп,скорняжная игла,первый
ЛОГОГРАФ,писатель,название первых греческих историков,специалист по логистике,второй
КУРЗАЛ,ёмкость для окурков,зал для курения,помещение на курорте предназначенное для отдыха,третий
ТРИОЛЕТ,оружие XIX века,азербайджанская боковая флейта,твердая стихотворная форма,третий
МАСКАРОН,музыкальное произведение для струнных,вид бабочек,вид скульптурного украшения,третий
ГУАНО,маленький мешочек затягиваемый шнурком,растение в Африке,органическое удобрение,третий
